Number of finished trials:  33
Best trial:
  Value:  -310.6081237792969
  Params:
    batch_size: 512
    n_steps: 2048
    gamma: 0.995
    learning_rate: 0.6754957095662276
    ent_coef: 1.2180173204031782e-05
    clip_range: 0.4
    n_epochs: 20
    gae_lambda: 0.99
    max_grad_norm: 5
    vf_coef: 0.12776273510127314
    net_arch: medium
    ortho_init: False
    activation_fn: relu
  User attrs:

Best trial:
  Value:  -311.111328125
  Params:
    batch_size: 64
    n_steps: 2048
    gamma: 0.995
    learning_rate: 0.5077067766640514
    ent_coef: 0.0012371256094725678
    clip_range: 0.4
    n_epochs: 20
    gae_lambda: 0.9
    max_grad_norm: 0.3
    vf_coef: 0.12919500634409883
    net_arch: medium
    ortho_init: True
    activation_fn: relu

Best trial:
  Value:  -5.222810745239258
  Params:
    batch_size: 32
    n_steps: 2048
    gamma: 0.999
    learning_rate: 0.010904496287854684
    ent_coef: 0.001259977671000268
    clip_range: 0.4
    n_epochs: 10
    gae_lambda: 0.9
    max_grad_norm: 0.9
    vf_coef: 0.6721595298476187
    net_arch: tiny
    ortho_init: False
    activation_fn: relu
  User attrs:


Number of finished trials:  193
Best trial:
  Value:  6642.4560546875
  Params:
    batch_size: 256
    n_steps: 32
    gamma: 0.99
    learning_rate: 0.0007738352468075011
    ent_coef: 0.00010480509613791954
    clip_range: 0.2
    n_epochs: 20
    gae_lambda: 1.0
    max_grad_norm: 0.7
    vf_coef: 0.6935773867676382
    net_arch: XXL
    ortho_init: False
    activation_fn: tanh
  User attrs:

[I 2024-01-04 10:32:59,817] Trial 15 finished with value: 4706.80712890625 and parameters: {'batch_size': 8, 'n_steps': 128, 'gamma': 0.99, 'learning_rate': 0.0013175038349466453, 'ent_coef': 0.0009082364080774735, 'clip_range': 0.1, 'n_epochs': 20, 'gae_lambda': 0.8, 'max_grad_norm': 2, 'vf_coef': 0.7684250836197356, 'net_arch': 'small', 'ortho_init': True, 'activation_fn': 'relu'}. Best is trial 15 with value: 4706.80712890625.

[I 2024-01-04 10:08:08,014] Trial 6 finished with value: 4434.27490234375 and parameters: {'batch_size': 32, 'n_steps': 16, 'gamma': 0.9, 'learning_rate': 0.0016110338283275164, 'ent_coef': 4.006975889361867e-05, 'clip_range': 0.1, 'n_epochs': 1, 'gae_lambda': 0.9, 'max_grad_norm': 0.9, 'vf_coef': 0.8944931280036353, 'net_arch': 'small', 'ortho_init': False, 'activation_fn': 'tanh'}. Best is trial 6 with value: 4434.27490234375.

Trial 10 finished with value: 2106.53076171875 and parameters: {
	'gamma': 0.995,
	'normalize_advantage': True,
	'max_grad_norm': 2,
	'use_rms_prop': False,
	'gae_lambda': 0.98,
	'n_steps': 256,
	'learning_rate': 0.0011289028886746742,
	'ent_coef': 0.00020580837378205268,
	'vf_coef': 0.20383559076740454,
	'net_arch': 'XL', 
	'ortho_init': False, 
	'activation_fn': 'relu'
}

Trial 11 finished with value: 3031.8056640625 and parameters: {
	'gamma': 0.99, 
	'normalize_advantage': False, 
	'max_grad_norm': 0.3, 
	'use_rms_prop': True, 
	'gae_lambda': 0.92, 
	'n_steps': 16, 
	'learning_rate': 0.7792897743192193, 
	'ent_coef': 0.08822977162101774, 
	'vf_coef': 0.3742976107431186, 
	'net_arch': 'XL', 
	'ortho_init': True, 
	'activation_fn': 'relu'
}
